{
    "title": "Wall Crawl",
    "preparation":"Stand up straight facing a wall. Extend your right arm with your elbow soft (not locked) and place your hand on the wall at shoulder height.",
    "execution": "Slowly walk your fingers upward, stepping in toward the wall as your hand climbs higher. Stop when you feel mild tension in your shoulder. Hold 10 to 30 seconds. Slowly walk your fingers back down the wall and return to the starting position. Repeat three to four times. Switch arms and repeat.",
    "example": "../../assets/wall-crawl.gif",
    "exampleAlt": "Gif of woman doing a wall crawl",
    "targets": ["shoulder"]
}
