{
    "title": "Overhead Triceps Stretch",
    "preparation":"Put one arm overhead. Position forearm as close as possible to upper arm. Grasp elbow overhead with other hand.",
    "execution": "Pull elbow back and toward head. Hold stretch. Repeat with opposite arm.",
    "example": "../../assets/overhead-triceps-stretch.gif",
    "exampleAlt": "Gif of man doing overhead triceps stretch",
    "targets": ["arms"]
}
